,video_id,text
0,yjSgBIT6dbk,안녕하세요/음악 오늘은 분 술에 선수로 따 초만에 닦은 다음 법 음악 자아 이거 폼 여는 클랑 약 채워 채워줘요/어떻게 이렇게 빨리할 수 있느냐 우리가 분수를 소수로 바꾸는 이유는 뭐예요/우리가 쉽진 들었으니까 순위 크기를 가늠할 수가 있죠/근데 보통 이걸로도 가능해요/아 반보다는 크구나/근데 이제 정확히는 모르죠/팜 범행이라고 하면 셋 중에 툴 정도 되겠구나/뭐 이렇게까지 날 수 있는데 이제 정확하게 나타내 라 소수로 일반적으로는 어떻게 풀어 저게 씻고 나누기 이니까 우로 나눈 미샤 하나 붙이고 뭐 이렇게 가지고 빼고 음악 이렇게 해서 복잡하게 이제 풀어요/풀다 보면 은 이게 이제 반복이 되거든요/그럼 아 이건 반복 때문에 이제 그때 가서 반복되는 것을 쓰는데 이렇게 하면 안 돼요/칼로 합니다/이 문제를 보면은 소수라는 거에 의미를 알아야 돼요/우리가 쓰면 수 진수 일 십백천 많이 몇 개 있냐/이 말이요/그런데 소수 니까 보다 작을 때는 다시 말해서 일 분의 천분의 일동으로 나누어 팩을 하는 첫눈 오다는 것들이 몇 개냐 로 나타내면 쉽죠/그래도 우리가 이런 거 아쉬웠죠/분에 이것은 곧바로 분위를 곱해 쓰니까 여기 다도를 곱하면 은 신이 그래가지고 이렇게 바로 그랬죠/그래서 아내가 붐 무가 일 십백천만 원 나타내야 되는데 은 여기 하에 로 있어서 절대 백철만 으로 나타낼 수 없어요/수영 많은 대 첨부 다 쉬운 수는 무엇일까 음악 태풍 어려운 사람은 바로 말 왜 잡으니까 그래서 이것은 그대로 위 알의 을 곱하면 구식 분의 윤 월 부품에는 인 을 빼면 이제는 것은 왜 주었어요/바로  다시 말해서 을 으로 나누는데 하나를 남겨 놓고 나는 하는 거 보고 싶지를 으로 남았어/그럼 이 줘/그런데 한계를 빼빼로 않았으니까 이 이거 개가 그대로 남아있네요/이 말이죠/그래서 이게 원래 나머지가 점 꽃이 리 남아 있는 거예요/남아있으니까 아직 안 끝났으니까 다시 나눠야 줘로 나누는 거예요/으로 나누면 은 친히 되겠지/그렇죠 추 그리고 또 나머지가 이만큼이 생각해 결국은 엄격 몰츠 치리 가 워치 이렇게 되는 거죠/그래서 여기는 이렇게 우리가 쓰는 거죠/이것이 총 다음악 그래 소수로 만드는 것은 굉장히 버티기 오면 쉽 쩍 심해 분의 한 이것은 분의 이것은 이렇게 된 거죠  그저 분의 그러면 부분 의원 처음으로 나으니까 병 점 년 삽니다/그렇게 되겠네/그래서 항상 이렇게 쉽고 않은 것으로 풀면 은 내가 알고 있는 걸로 자신 있게 푸는 거죠/으 수확할 때 뭐 굳이 부분에 내어주고 분에 그래 뭐 이런 거를 호수로 쉽게 바꾸거나 요렇게 순환 소스로 바꾸는 거 있었는데 그럼 예를 들어서 엄마 분모가 인 거 아 방법 같은 것은 어떻게 또 쉽게 하죠/아 그렇죠/사실 허리가 이거를 중 아픈데 무작정 물 구조와의 귀가 지금 여기 너무 풀어준 것은 외우는 방안 엄지 총 악하게 왜 그런지 캬 지를 알려줍니다/그럴 땐 운송 원해서 에디터 이러고 흔녀라는 걸 문의 이것은 스스로 바꿔라 그러면 이것은 후에 떨어지죠/빡 그래서 사진은 분에 이루죠/이런 문제가 나오면 아흔까지는 곱한 심히 줘 힘을 거다 내면은 그대로 부분을 인물 뭐 이렇게 함께 하라 그래서 이것을 쓸 줄 아는 애 을 일단 걷어내고 그다음 쓰게 되면의 이 일  이것을 무술 앞에 내라는 것은 이 항상 생각을 해 소수 보다 작은 걸 나타낼 때 쓰기 때문에 이런 걸 보면 자연사 부분은 이뤄내고 생각하는 게 슈얼 그러니까 북 은행이 좁아진 부위를 묵은 삶과 분에 위기로 분 음악 그러니까 얘기 이제 그러니까 분에 이를 보면 이런 건 끌리는지 뭐 이루는데 이름은 제 머리 남기는 하면 절대 안 돼요/그래도 악마라고 했죠/왜 락 맨 양 음 그리고 조금 복잡하면 음식을 적용할 수가 요령을 적용할 수가 없게 돼/그래서 꽤 뜯어내는 쉽게 할 수 있고 의무 안되는 난 기회를 항상 이야기란 아시겠죠/아 어느 분수의 속으로 분 아카 속 질문이 있으시면 댓글에 달아주시면 자 또 이렇게 물을 만드는 더 돌면서 수 안 점 상 또 록의 음악 으음악으으으 으
1,UKD3ZmGLPt4,여러분들 허수 아이에 대해 처음 접할 때 반감이 들진 않으셨나요/의 루트를 씌워서 아이라고 하죠/루트를 씌울 수 없는 줄 알았던 수에 루트를 씌워서 새로운 수로 정의한다고 했을 때 아니 실수들만 가지고 수확을 해도 충분히 힘든데 왜 이런 이상한 술을 또 만들어서 복잡하게 할까/이 아이가 왜 필요한지 왜 배워야 하는지에 대한 설명 없이 이렇게 일방적으로 새로운 수를 정의하는 건 동기부여에 좋지 않은 방법일 수도 있을 것 같아요/저는 호기심도 좀 많은 편이어서 이런 의문이 들긴 했었어요/아니 마이너스의 루트를 씌워서 새로운 수라고 정의를 한다면 그럼 이 새로운라는 수에다가 루트를 씌워서라고 새로운 수로 정의해도 되지 않나/그리고 그 제의에다가 또 루트를 씌워서 이런 수를 하고 정의하고 이렇게 계속 새로운 수를 정해 나가도 되지 않나 이런 의문이 들었어요/사람이 한 번 어렵지 한 번 하고 나면 두 번 세 번 씹잖아요/안되는 루트를 씌웠으니 그다음은 또 왜 안 되나 싶었어요/그런데 이 질문에 대한 답은 나중에 복습 표현에 대해 배우면서 해결이 되었어요/이런 제의나 같은 수가 필요가 없구나라는 사실을요/그리고 나중에 대학교 가서 대수학의 기본 정리를 배우면서 이 아이가 왜 필요한지에 대해서 보다 명확해졌어요/그래서 오늘은 그 얘기를 좀 해보려고 합니다/왜 아이의 개념이 필요한지 왜 아이를 배워야 하는지 왜 제의나 같은 수가 필요가 없는지 그런 개념을 대수하게 기본 정리가 말해주는데 이 정리를 알게 되면 허수의 개념을 처음 익힐 때 동기부여가 될 수 있을 거라 생각해요/이 아이가 필요한 이유는 공학적인 관점에서도 여러 가지가 있지만 순수하게 수학적인 관점에서 볼 때 이 대수학의 기본 정리가 핵심이라 생각합니다/대수학의 기본적 영어로는 펀드 메탈 니스의 기본 정리에서 이 대수학이라고 하면 이 대사가 큰 대자가 아니라 대신할 대자예요/문자로 대신 써서 해를 찾는 방법을 말하는 학문이라고 이해하시면 돼요/ 이라는 방정식이 있다고 하면 여기서는이라는 해를 찾는 거예요/우리가 초등학교 때 덧셈 뺄셈 곱셈 나눗셈 배우고 이런 차 그리고 이 계수를 복소수 계수로 확장하더라도 차 방정식은 항상 두복 소수 끈을 가지게 돼요/제곱 빼기  이런 복소수 계수의 차 방정식은 이런 식으로 복소수 범위 안에서 항상 인수분해가 돼요/항상 두 근을 가진다는 얘기죠/두 근이 똑같아서 중근이 될 수도 있지만 중복을 포함해서 항상 두 개의 근이 존재하게 되는 거죠/실수 안에서 놀면 근이 있을 수도 있고 없을 수도 있고 이런 불편한 점이 있었다고 하면 복소수 체계 안에서 놀리게 되면 언제나 흔히 두 개 존재한다고 말할 수 있게 되는 겁니다/차 방정식 차 방정식의 그는 어떨까요 복소수 개수의 차 차 방정식은 복소수 안에서 해를 항상 개 개 가지고 있을까요/가 임의의 복소수일 때 이런 차 방정식의 해가 복소수 안에서 개 존재할까요/이 대수학의 기본 정리는 바로 그 질문에 대한 해답을 주고 있습니다/복소수 계수의 차 방정식은 복소 수혜를 항상 가진다 이게 대소하게 기본 정리예요/그래서 이 정리를 진리로 받아들인다면 주어진 차 방정식에 대해서 어떤 복소수의 이 향상이 있고 그래서 그 차 방정식을 과 차 방정식으로 인수분해 할 수 있고 그리고 이 차 방정식에 대해서도 역시 대수학의 기본 정리해서 복소수 해가 있기 때문에 얘도 인수분해가 되고 그래서 연쇄적으로 결국 주어진 차 방정식은 이런 차항들로 인수분해가 된다는 말입니다/즉 이 아무리 크더라도 중복을 포함해서 복소수 끈이 정확히 개가 항상 존재하는 거죠/이 정리의 의미를 잘 이해하게 되면 제가 영상 초반에 말씀드렸던 루트 같은 수 이런 걸 새롭게 와 같은 수로 정의할 필요가 없게 돼요/루트라는 건 제곱해서 아이가 되는 수일 테니까 제곱은 즉 다시 말해서 제곱 우는이라는 방정식의 해일 거예요/근데 이 차 방정식은 복소수 계수의 차 방정식이기 때문에 항상 복소 수해를 가진다는 게 대 수업의 기본 정리가 해주는 얘기예요/그래서 실제로 제곱하면 가 되는 수가 복소수 체계 안에서 존재한다는 말입니다/실제로 루트 불의의 이런 수를 제곱하게 되면가 나와요/이걸 제곱했다고 하면 실수부가 이 되고 허수부가 아이가 나와요/제곱하면 다 나오는 수가 됩니다/그러니까 따로라는 수를 정의할 필요가 없었던 거죠/이렇게 수 체계를 복소수 범위까지 확장하고 나면 고차방정식을 푸는 데 있어새로운 두 체계가 필요하지 않게 되는 거예요/그래서 우리가 실수만 가지고 놀 때에 비해서 만족스러운 결과를 얻게 됩니다/어떤 고차방정식이 나오더라도 그 방정식의 해가 반드시 있는 것이 보장이 되는 것이죠/그럼이 대수학의 기본 정리를 어떻게 믿느냐 이게 참이라는 것에 대한 증명을 보여드리고 그게 납득이 되시면 믿을 수 있겠죠/이 대수학의 기본 정리를 증명하는 것은 그렇게 어렵지 않아요/복소수에 대한 약간의 기초 지식이 필요하긴 한데 그렇게 어렵지 않고 증명 과정이 상상력을 키우고 수학적인 사고를 하는 데 도움이 많이 됩니다/그래서 이번 영상에서 한번 다뤄보려고 해요/복소수가 익숙하지 않으신 분들은 초반에 약간 어려울 수도 있는데 뒤에 재밌는 아이디어들이 나오니 한번 따라와 보세요/우리가 실수를 표현할 때는 보통 수직선을 그리고 실수 하나를 점으로 표기를 하죠/그리고 차원 상의 좌표를 표현할 때는 평면을 그려서 평면 위의 한 점 콤마로 표기를 합니다/이 복소수라는 녀석은 실수부 와 허수부로 나누어지기 때문에 이 복소수를 표현하려면 두 개의 실수가 필요하죠/그래서 단순히 하나의 수직선이 아닌 이 콤마 좌표로 표현하게 됩니다/차원 좌표상에 점 하나가 복소수 하나를 의미하게 되는 거죠/이라는 점이 복소수를 의미합니다/그리고 이 평면을 복소평면이라고 해요/평면상에 있는 점 하나하나가 모두 복소수 하나의 대응이 된다고 이해하시면 됩니다/그리고 이 점을 표기하기 위해서 두 개의 실수 가 필요했죠/이라는 직교 좌표 대신에 극좌표로 같은 점을 표기할 수도 있어요/이까지의 거리를 그리고 동경을 라고 하면은 과 세타가 확정이 되면의 점이 확정이 되죠/우리가 세타를 알 때를 구할 수도 있고를 알 때 세타를 구할 수도 있습니다/그래서 하나의 복소수를 이런 극 좌표계를 이용해서 과 세타로 표현하기도 해요/이 극 좌표계가 왜 유용하냐면 두 복소수와  가 있을 때 이점을 콤마라고 해볼게요/두복 소수를 곱한다는 의미가 어떻게 되는지를 보면 둘을 곱하면 실수분은 빼기 가 될 거고 허수분은  가 되겠죠/그래서 이 두 복소수를 곱한 복소수도 이 복소평면 상에 어딘가 있을 텐데 그 점을 찍어보면 이런 데 있어요 이 콤마를 극 좌표계로 나타냈을 때 세타 이를 극 좌표계로 나타냈을 때 세타라고 한다면 이  콤마 의 극좌표는 반지름이 곱하기 그리고 이 동경은 새 타운 세타가 된다는 사실을 그렇게 어렵지 않게 계산을 통해서 알 수 있어요/삼각함수를 조금 배우고 나면 그렇게 어렵지 않게 과 을의 식으로 표현을 할 수가 있고 그래서 왜이 두 개를 곱한 수가 반지름 길이 곱하고 동경은 더한 점이 되는지를 계산으로 볼 수 있는데 그 과정을 생각하겠습니다/그래서 두 수를 곱한 게 반지름끼리 곱하고 동경은 더하게 되니까 예를 들어서를 제곱을 하게 되면 그 제곱을 한 복수 수는 이렇게 반지름은 기존 반지름의 제곱이 되고 동경은 배가 되는 점 이런 점으로 제곱을 하면 이동해 가요 자 그래서 아까 제곱해서 가 되는 수가 만족하는 차 방정식 이거의 해가 루터 분의  가 하나의 해라고 했죠/자 이것도 어떻게 이렇게 나오는지를 보면 이는 수는 극 좌표계로 표현하면 반지름이고 동경은 도에요/그래서 어떤 수의 제곱을 했는데 반지름이이고 동경이 도라는 건 반지름도이고 동경이 정확히 도에 있는 점 반지름은 제곱해서 동경이 배가 되니까 이러는 점으로 가겠죠/허점이 뭔지를 찾아보면 이 좌표가 루트 루트 분의이죠/그래서 이런 수가 바로 루트 가 되는 겁니다/이걸 만족하는 회가 하나 더 있죠/반대쪽에 이런 점도 제곱을 하게 되면 동경이 도 그리고 도를 한 번 더 돌면 도갑 되겠죠/그래서 이런 점도 제곱 마이너스 콜의 하나의 해가 돼요/우리가 함수를 배울 때 정의역과 공력이 있다고 배우죠/그리고 정의역에 있는 한 점이 공력에 있는 어떤 한 점으로 이동해 간다/이렇게 외우죠/이런 식으로 함수를 표현하기도 하죠/에다가 을 넣으면은 이 나오는 이런 게 함수라고 배우죠/방정식에서도 제곱인의 두 근을 구하라는 말과는 제곱 빼기라는 함수가 그래프로 그려보면 이런 식으로 나오니까 이 그래프가 축과 만나는 점에 그게 제곱 마이너스 이고이라는 방정식의 두 근이다는 것과 같은 말이죠/그래서 이렇게 실수해서 실수로 가는 함수는 정의역을 축으로 표현하고 공력을 축으로 표현해서 이렇게 좌표 평면상에 그래프로 보통 표현을 합니다/그런데 복소수에서 복소수로 가는 함수는 정의 역 자체가 이런 수직선이 아니라 평면상에 있는 모든 점들이죠/정의역 자체가 평면 위에 있는 모든 점이고 공력이 또 평면 위에 있는 모든 점이에요/어떤 복소수가 어떤 복수 수로 함수에 의해서 가는 거죠/그래서 이 함수를 한 번에 보여주려면 차원이 필요해서 시각화가 좀 어려워요/그래도 왼쪽에 있는 좌표 평면이 정의역 않고 오른쪽에 있는 좌표 평면이 공격이라 생각하고 이렇게 우리가 원래 함수 정의 역에서 공역으로 가는 화살표 이걸 함수라고 생각을 해서 요런 방법으로 복소수에서의 함수를 이해해 봅시다 예를 들어서 이런 차 방정식이 있다고 해볼게요/그리고 이 방정식의 근이 있는지 알고 싶다고 해봅시다/그래서 이 거르려고 놓고 가 무엇일 때 가이 되는지 그걸 알고 싶다고 해봐요/에 대해서 조금 더 이해를 해봅시다 예를 들어서 에다 가이라는 점을 넣으면 가 나올 거예요/그게 이 정의역과 공역에서 어떤 의미인지를 보면 정의역에서 은 여기죠/그리 고을 넣었을 때 가 나오니까 이런 점이 나옵니다/즉이 는을 점으로 옮기게 됩니다/그리고 마찬가지로 복소수에 있는 점들이 다이 차 함수에 의해서 어딘가 다른 복소수가 되겠죠/여기서 우리가 궁금한 건 과연 어떤 점을 넣었을 때 이 공력에서이라는 점으로 갈 것인가 어떤 점이 있어서 그 점을 하우스에 넣으면 그 점이 가는 점 그 점이 이런이라는 점으로 매핑이 되는가 이런 점이 과연 정의역에 존재할 것인가 그게 이는이라는 방정식의 해가 있느냐라는 질문인 거죠/그래서 우리는 어떤 이런 점이 존재해서 이 함수에 의해 서로 가더라라는 걸 보일 수 있으면 이 방정식의 해가 있다고 얘기를 할 수 있는 겁니다/자 여기서부터 재밌는 얘기가 시작이 돼요/잘 집중해서 들어보세요/정의역에서 울 중심으로 어떤 원을 한 바퀴 쭉 돌면서 이 원 위에 있는 점들이 이 차 함수어 의해서 어디로 매핑이 될지 그걸 한번 상상해 볼 겁니다/근데 이 원을 아주아주 큰 원 그리고 아주아주 작은 원 두 개를 잡아 볼 텐데 먼저 큰 원을 잡아 볼게요/예를 들어서 반지름이 백인 큰 원을 잡아 봤다고 해볼게요/자 이원을 한 바퀴 돌면서 이 원위에 있는 점들이 차 함수에서 어떤 궤적으로 이동하는가 그걸 한번 보고 싶은 거예요/자 먼저 이 차항만 어디로 가는지를 한번 보시죠/여기서 시작하면 이 시작점인 에디가 승을 하면은의 승은만이에요/그래서 이 승 항만 보면은 이는 점을 넣었을 때의 뒤에 개 붙어있는 만이라는 점에 가 있어요/같은 스케일이 아니겠죠/굉장히 줌 아웃을 당겨서 굉장히 큰 그림으로 보는 겁니다/이원을 따라서 이렇게 가 이동해서 여기 있다고 하면은 이 아니 저 여기가 이 백 아이까지 가면 그때 승은 어떻게 이동하는지를 보면의 세제곱 은반 지름은 여전히 길이의 승인 만일 거고 동경은 도음아 이렇게 삥 돌 동안 어떤 궤적을 그릴까를 상상을 해보시면 처음 시작점은 이 백만에서 만 아이만큼 수직으로 위로 이동하고 만큼요/도 각도로 찔끔 가고 그다음에 화의 값으로 이렇게 찔끔 돌아와 가지고 뭐 여기에 어떤 점에서 시작을 하겠죠/가 요렇게 도는 동안 어떤 식으로 움직여 갈까를 상상을 해보시면 사실상 반지름이 만인원 세 바퀴를 도는데 그 와중에 정확히 원이 아니라 원에서 조금 이탈한 점들을 휘청휘청 되면서 도는 휘청휘청 되면서 세 바퀴를 도는 그런 궤적을 그릴 거예요/바로 이창 차항 상수항이 약간 이탈한 정도가 얼마일지를 결정을 하고 사실상이 큰 원 세 바퀴를 도는 궤적을 그릴 겁니다/조금 더 극단적으로 반지름을 훨씬 늘려서 여기에 을 한 개 더 붙여보면 어떻게 될까요/정의 역에서 이름이 천인 원을 따라서 움직인다 그러면 이제 승 항은 만이 아니라 개 더 붙여서 억 짜리 반지름을 세바퀴 돌 거고요/이 창은 천만 아이니까 천만은 억에 분의이죠/아까가 분의 이었다면 이번에 분의 이 될 거예요/그래서 분의 해당하는 원이 거의 눈에도 잘 안 보일 정도로 조그만 원을 두 바퀴를 도는 형태가 되겠죠/차 상수항이 더 보잘것없어지면 말할 필요도 없습니다/그래서 사실상이 억짜리 원 세 바퀴를 돌고 그 정확히 그 원상이 아니라 원에서 이탈한 정도는 더 눈에 안 보일 정도로 작아지는 그런 느낌이 되겠죠/반지름이 충분히 큰 원을 한 바퀴 돈다고 했을 때 공력에서 보면 사실상 매우 큰 원을 바퀴 돈다 차 방정식이면 바퀴 돈다고 이해를 하시면 되겠습니다/자이 그림을 기억해/것이고 이번엔 반대로 미시세계로 가볼게요/아까는 거시 세계에서 우주에서 놀았다면 이번엔 양자역학과 같은 미시세계로 가보겠습니다/이 정의역에서 반지름이 아주 작은 인 반지름을 한 바퀴 이렇게 빙글 돌아보겠습니다/그때 이 점들이 어떤 점으로 매핑이 되는가를 한번 상상해 볼게요/그럼 이번엔 반대로 차항 차항이 보잘 것이 없어져요/의 세제곱하게 되면 음악이 되고요/이 차항을 보면 아주 작지 작은 원을 세바퀴를 이렇게 빙글빙글빙글 돌겠죠/이게 한 바퀴를 돌 동안요/차항을 보면의 제곱에다가 배를 하니까 분의  시작을 하겠죠/그러니까 여기 도상에서 분의 만큼의 반지름을 가지고 두 반지름이 배길 때는 이렇게 어마어마하게 큰 원을 이렇게 돌고 있었죠/근데 반지름이 이면요/상수항 주변을 요렇게 움직이고 있습니다/그러면 정의역에서 반지름 일 때부터 반지름이 일 때까지 원을 점점점 사이즈를 줄인다고 해볼게요/연속적으로 줄어드니까 공역에서의 궤적 역시 점점점 연속적으로 변하겠죠/그리고 변하고 변하고 변하다가 언젠가는 이 주변에서 깨작깨작 되는 궤적으로 바뀌겠죠/그러면 그 줄어드는 궤적 어딘가에서는 이 원점을 쳐야겠죠 반지름이 이렇게 큰 원에서 작은 원으로 줄어들면 해당하는 궤적이 요원에서 요/원 세 바퀴에서 점점점 줄어들다가 언젠가는 그 궤적이 원점을 지나는 그런 게 한 번은 있어야 나중에 결과적으로 요/ 주변에서만 깨작깨작 되는 궤적으로 가겠고 게 언젠지는 알 수 없지만 연속적으로 변하려면 어쩔 수 없이 여기를 한 번은 지나야 돼요/주요 부분이 납득이 가시나요/제가 이해를 돕기 위해서 차 함수의 이런 예시를 들긴 했지만 똑같은 얘기를 일반적인 차 방정식에 대해서도 할 수 있어요/그리고 뭐 계수를 큰 원을 반지름을 반지름을 노 예를 들었지만 이것 역시 주어진 계수에 따라서 반지름을 충분히 크게 잡고 또 충분히 작게 잡아서 그 사이에 공력의 원점이 들어오게 할 수 있어요/그럼 그 얘기는 어떤 고차방정식을 가져오더라도 그 방정식을 이로 만드는 점이 정의 역에 존재한다는 의미고 그게 바로 대수학의 기본 정리가 하는 얘기입니다/그리고 그것이 바로 복소수 체계의 완결성이 있는 이유고 그래서 우리는 아이까지만 배우면 되고 더 이상수 체계를 확장할 필요가 하나의 이유가 되는 거예요/자 오늘은 대수학의 기본 정리에 대해서 한번 알아보았고요/오늘 영상이 유익하셨다면 구독과 좋아요/부탁드리고 다음 시간에 또 재미있는 수학 얘기로 찾아뵙겠습니다/감사합니다
